<?xml version="1.0" encoding="UTF-8"?>
<!DOCTYPE job-req-template PUBLIC "-//SuccessFactors, Inc.//DTD Job Requisition Template//EN" "job-req-template.dtd">
<job-req-template type="jobReq" spell-check="true" min-posting-days="14" min-internal-lead-days="0">
 <template-name><![CDATA[Requisition Template]]></template-name>
 <template-name lang="en_US"><![CDATA[Requisition Template]]></template-name>
  <template-desc><![CDATA[]]></template-desc>
  <template-lastmodified>3/5/06 12:00 AM</template-lastmodified>
  <supported-languages>
    <lang><![CDATA[en_US]]></lang>
    <lang><![CDATA[fr_CA]]></lang>
    <lang><![CDATA[en_GB]]></lang>
    <lang><![CDATA[de_DE]]></lang>
    <lang><![CDATA[ja_JP]]></lang>
    <lang><![CDATA[ko_KR]]></lang>
    <lang><![CDATA[nl_NL]]></lang>
    <lang><![CDATA[pt_BR]]></lang>
    <lang><![CDATA[es_ES]]></lang>
    <lang><![CDATA[zh_CN]]></lang>
  </supported-languages>
  <default-listing-layout-id><![CDATA[2]]></default-listing-layout-id>
  <field-definition id="cust-intro-req" type="instruction" required="false" header="false" custom="true">
  <field-label mime-type="text-html" screenreader-text=""><![CDATA[<table frame="border" width="100%">
<tr><td style="background-color:#6699FF" valign="bottom"><b>Instructions</b><br></td></tr></table>
<li>Please fill in all relevant fields below. 
<li>All fields marked with <span class="required" title="Required">*</span> are mandatory.<br> 
<li>Please contact your HR team for help and guidance.]]></field-label>
  </field-definition>
  <field-definition id="jobPostLanguage" type="text" required="false" custom="false">
  <field-label><![CDATA[Post Job in Language(s)]]></field-label>
  <field-label lang="de_DE_SF"><![CDATA[Sprachen Veröffentlichung]]></field-label>
  </field-definition>
  <field-definition id="defaultLanguage" type="text" required="true" custom="false">
  <field-label><![CDATA[Default Language]]></field-label>
  <field-label lang="de_DE_SF"><![CDATA[Standardsprache]]></field-label>
  <field-description><![CDATA[Default Language]]></field-description>
    <default-value>en_US</default-value>
  </field-definition>
  <field-definition id="title" type="text" required="true" custom="false">
  <field-label><![CDATA[Job Title]]></field-label>
  <field-label lang="de_DE_SF"><![CDATA[Job Titel]]></field-label>
  <field-description><![CDATA[Position Title]]></field-description>
  </field-definition>
  <field-definition id="extTitle" type="text" required="true" custom="false">
  <field-label><![CDATA[External Job Title]]></field-label>
  <field-label lang="de_DE_SF"><![CDATA[Externer Job Titel]]></field-label>
  <field-description><![CDATA[External Position Title]]></field-description>
  </field-definition>
  <field-definition id="jobCode" type="text" required="true" custom="false">
  <field-label><![CDATA[jobCode]]></field-label>
  <field-description><![CDATA[Job Code]]></field-description>
  </field-definition>
  <field-definition id="customString9" type="jobCode" required="true" custom="false">
  <field-label><![CDATA[Pay Grade]]></field-label>
  <field-description><![CDATA[Job Grade]]></field-description>
  </field-definition>
  <field-definition id="customString2" type="jobCode" required="true" custom="false">
  <field-label><![CDATA[Job Level]]></field-label>
  <field-description><![CDATA[Job Level]]></field-description>
  </field-definition>
  <field-definition id="customString5" type="jobCode" required="true" custom="false">
  <field-label><![CDATA[Reg/Temp]]></field-label>
  <field-description><![CDATA[Regular or Temp]]></field-description>
  </field-definition>
  <field-definition id="customString6" type="jobCode" required="false" custom="false">
  <field-label><![CDATA[Employee Class]]></field-label>
  <field-label lang="de_DE_SF"><![CDATA[Klassifizierung]]></field-label>
  </field-definition>
  <field-definition id="customString7" type="jobCode" required="false" custom="false">
  <field-label><![CDATA[Is Full Time employee]]></field-label>
  <field-label lang="de_DE_SF"><![CDATA[Vollzeit/Teilzeit]]></field-label>
  </field-definition>
  <field-definition id="customString11" type="jobCode" required="false" custom="false">
  <field-label><![CDATA[EEO Job Category]]></field-label>
  <field-label lang="de_DE_SF"><![CDATA[EEO Job Kategorie]]></field-label>
  <field-description><![CDATA[eeo job category]]></field-description>
  </field-definition>
  <field-definition id="customString13" type="jobCode" required="false" custom="false">
  <field-label><![CDATA[Salary Range - Low]]></field-label>
  <field-label lang="de_DE_SF"><![CDATA[Grundgehalt]]></field-label>
  <field-description><![CDATA[]]></field-description>
  </field-definition>
  <field-definition id="customString12" type="jobCode" required="false" custom="false">
  <field-label><![CDATA[Salary Range - High]]></field-label>
  <field-label lang="de_DE_SF"><![CDATA[Grundgehalt]]></field-label>
  <field-description><![CDATA[]]></field-description>
  </field-definition>
  <field-definition id="budgeted" type="picklist" required="false" custom="true">
  <field-label><![CDATA[Position Budgeted]]></field-label>
  <field-label lang="de_DE_SF"><![CDATA[Position budgetiert]]></field-label>
  <field-description><![CDATA[bugetl]]></field-description>
    <picklist-id>yesNo</picklist-id>
  </field-definition>
  <field-definition id="currency" type="enum" required="false" custom="false">
  <field-label><![CDATA[Currency]]></field-label>
  <field-label lang="de_DE_SF"><![CDATA[Währung]]></field-label>
  <field-description><![CDATA[Select a currency for monetary fields on this Job Requisition]]></field-description>
    <default-value>USD</default-value>
  </field-definition>
  <field-definition id="erpAmount" type="currency" required="false" custom="false">
  <field-label><![CDATA[Employee Referral Amount]]></field-label>
  <field-description><![CDATA[Employee Referral Bonus Amount]]></field-description>
  </field-definition>
  <field-definition id="relocationPack" type="picklist" required="false" custom="false">
  <field-label><![CDATA[Approved for Relocation?]]></field-label>
  <field-label lang="de_DE_SF"><![CDATA[Genehmigt für Umzug?]]></field-label>
  <field-description><![CDATA[relo]]></field-description>
    <picklist-id>yesNo</picklist-id>
  </field-definition>
  <field-definition id="listingLayout" type="richText" required="false" custom="false">
  <field-label><![CDATA[Internal Job Description]]></field-label>
  <field-label lang="de_DE_SF"><![CDATA[Interne Jobbeschreibung]]></field-label>
  <field-description><![CDATA[]]></field-description>
  </field-definition>
  <field-definition id="extListingLayout" type="richText" required="false" custom="false">
  <field-label><![CDATA[External Job Description]]></field-label>
  <field-label lang="de_DE_SF"><![CDATA[Externe Jobbeschreibung]]></field-label>
  <field-description><![CDATA[External Job Description]]></field-description>
  </field-definition>
  <field-definition id="status" type="picklist" required="false" custom="false">
  <field-label><![CDATA[Progress]]></field-label>
  <field-label lang="de_DE_SF"><![CDATA[Fortschritt]]></field-label>
  <field-description><![CDATA[After the job req is released, this field tracks the progress]]></field-description>
    <picklist-id>jobReqStatus</picklist-id>
  </field-definition>
  <field-definition id="numberOpenings" type="number" required="false" custom="false">
  <field-label><![CDATA[Number of Openings]]></field-label>
  <field-label lang="de_DE_SF"><![CDATA[Anzahl offene Stellen]]></field-label>
  <field-description><![CDATA[Number of Openings]]></field-description>
  </field-definition>
  <field-definition id="hiringManagerName" type="operator" required="true" custom="false">
  <field-label><![CDATA[Hiring Manager]]></field-label>
  <field-label lang="de_DE_SF"><![CDATA[Einstellender Manager]]></field-label>
  <field-description><![CDATA[This is the hiring manager]]></field-description>
  </field-definition>
  <field-definition id="recruiterName" type="operator" required="true" custom="false">
  <field-label><![CDATA[Recruiter]]></field-label>
  <field-description><![CDATA[This is the recruiter]]></field-description>
  </field-definition>
  <field-definition id="sourcerName" type="operator" required="false" custom="false">
  <field-label><![CDATA[Recruiting Manager]]></field-label>
  <field-description><![CDATA[This is the sourcer]]></field-description>
  </field-definition>
  <field-definition id="start" type="date" required="false" custom="false">
  <field-label><![CDATA[Posting Start]]></field-label>
  <field-description><![CDATA[]]></field-description>
  </field-definition>
  <field-definition id="end" type="date" required="false" custom="false">
  <field-label><![CDATA[Posting End]]></field-label>
  <field-label lang="de_DE_SF"><![CDATA[Posting Ende]]></field-label>
  <field-description><![CDATA[]]></field-description>
  </field-definition>
  <field-definition id="intranetPosting" type="bool" required="false" custom="false">
  <field-label><![CDATA[Internal Posting]]></field-label>
  <field-label lang="de_DE_SF"><![CDATA[Internes Posting]]></field-label>
  <field-description><![CDATA[]]></field-description>
  </field-definition>
  <field-definition id="corporatePosting" type="bool" required="false" custom="false">
  <field-label><![CDATA[External Posting]]></field-label>
  <field-label lang="de_DE_SF"><![CDATA[Externes Posting]]></field-label>
  <field-description><![CDATA[]]></field-description>
  </field-definition>
  <field-definition id="agencyPosting" type="bool" required="false" custom="false">
  <field-label><![CDATA[Agency Posting]]></field-label>
  <field-label lang="de_DE_SF"><![CDATA[Agenturposting]]></field-label>
  <field-description><![CDATA[]]></field-description>
  </field-definition>
  <field-definition id="division" type="enum" required="true" custom="false">
  <field-label><![CDATA[Division]]></field-label>